{
  "baseline": "MedTech educational baseline v1",
  "disclaimer": "Five technical controls only; not a HIPAA compliance determination. PASS applies only to this baseline and explicit scope.",
  "findings": [
    {
      "control_id": "CLOUDTRAIL_LOGGING",
      "evidence": {
        "read_errors": [],
        "trails": [
          {
            "delivery_error_present": false,
            "full_management_events": true,
            "global_service_events": true,
            "home_region": "us-east-1",
            "is_logging": false,
            "qualifies": false,
            "trail_arn": "arn:aws:cloudtrail:us-east-1:123456789012:trail/medtech-audit"
          }
        ]
      },
      "id": "d62deee97a1ceae99017",
      "reason": "No proven qualifying active trail; inspect management-event coverage and delivery status.",
      "region": "us-east-1",
      "remediation": "Enable a covering trail with logging, global events, all read/write management events, and healthy delivery.",
      "resource": "regional-management-events",
      "severity": "HIGH",
      "status": "FAIL"
    },
    {
      "control_id": "EC2_ADMIN_PORTS",
      "evidence": {
        "exposed_rules": [
          {
            "cidrs": [
              "0.0.0.0/0"
            ],
            "ports": [
              22
            ],
            "protocol": "tcp"
          },
          {
            "cidrs": [
              "::/0"
            ],
            "ports": [
              3389
            ],
            "protocol": "tcp"
          }
        ]
      },
      "id": "6ee8994f49f5a8d90029",
      "reason": "Internet-wide administrative port rule found; actual reachability is not tested.",
      "region": "us-east-1",
      "remediation": "Restrict administrative ingress to approved sources or use Systems Manager Session Manager.",
      "resource": "sg-0123456789abcdef0",
      "severity": "HIGH",
      "status": "FAIL"
    },
    {
      "control_id": "IAM_MFA",
      "evidence": {
        "console_login": true,
        "mfa_device_count": 0
      },
      "id": "46b6c72ef257fa62c6ee",
      "reason": "Console IAM user has no enrolled MFA.",
      "region": "global",
      "remediation": "Enroll MFA for this console user; prefer federation and verify sign-in enforcement separately.",
      "resource": "analyst",
      "severity": "HIGH",
      "status": "FAIL"
    },
    {
      "control_id": "IAM_MFA",
      "evidence": {
        "AccountMFAEnabled": 0
      },
      "id": "cc06ee06ae325623b848",
      "reason": "Root MFA enrollment baseline (centralized root credential removal needs manual exception review).",
      "region": "global",
      "remediation": "Protect root access with MFA or document and verify centralized root credential removal.",
      "resource": "root",
      "severity": "CRITICAL",
      "status": "FAIL"
    },
    {
      "control_id": "IAM_MFA",
      "evidence": {},
      "id": "5ac3b46f25e97ccc4993",
      "reason": "No console login profile observed; API-key/STS MFA enforcement is outside scope.",
      "region": "global",
      "remediation": "",
      "resource": "service-backend",
      "severity": "INFORMATIONAL",
      "status": "NOT_APPLICABLE"
    },
    {
      "control_id": "S3_ENCRYPTION",
      "evidence": {
        "default_algorithms": [
          "AES256"
        ]
      },
      "id": "efbb0fd1df4edaa91137",
      "reason": "Default encryption does not meet the project KMS baseline; SSE-S3 is still encryption.",
      "region": "us-east-1",
      "remediation": "Review KMS key policy/cost, then configure SSE-KMS or DSSE-KMS; assess existing objects separately.",
      "resource": "medtech-demo-patient-data",
      "severity": "MEDIUM",
      "status": "FAIL"
    },
    {
      "control_id": "S3_PUBLIC_ACCESS",
      "evidence": {
        "effective_known_flags": {
          "BlockPublicAcls": false,
          "BlockPublicPolicy": false,
          "IgnorePublicAcls": false,
          "RestrictPublicBuckets": false
        },
        "layers": {
          "account": {
            "BlockPublicAcls": false,
            "BlockPublicPolicy": false,
            "IgnorePublicAcls": false,
            "RestrictPublicBuckets": false
          },
          "bucket": {
            "BlockPublicAcls": false,
            "BlockPublicPolicy": false,
            "IgnorePublicAcls": false,
            "RestrictPublicBuckets": false
          }
        },
        "read_errors": {}
      },
      "id": "3f2ec9b510e066500743",
      "reason": "Public-access prevention baseline is incomplete; this does not prove data is public.",
      "region": "us-east-1",
      "remediation": "Review access requirements, then enable all four effective Block Public Access flags; inspect policies/ACLs separately.",
      "resource": "medtech-demo-patient-data",
      "severity": "HIGH",
      "status": "FAIL"
    }
  ],
  "generated_at": "2026-10-11T12:00:00+00:00",
  "mode": "SIMULATED",
  "run_id": "demo-misconfigured",
  "schema_version": "1.0",
  "scope": {
    "account_id": "123456789012",
    "buckets": {
      "medtech-demo-patient-data": "us-east-1"
    },
    "regions": [
      "us-east-1"
    ]
  },
  "summary": {
    "assessed_pass_percent": 0.0,
    "controls": {
      "CLOUDTRAIL_LOGGING": "FAIL",
      "EC2_ADMIN_PORTS": "FAIL",
      "IAM_MFA": "FAIL",
      "S3_ENCRYPTION": "FAIL",
      "S3_PUBLIC_ACCESS": "FAIL"
    },
    "counts": {
      "FAIL": 6,
      "NOT_APPLICABLE": 1,
      "PASS": 0,
      "UNKNOWN": 0
    },
    "coverage": "COMPLETE_WITHIN_SCOPE",
    "risk_counts": {
      "CRITICAL": 1,
      "HIGH": 4,
      "MEDIUM": 1
    },
    "status": "FAIL"
  }
}
